{
  "version": "moral-trade-operations-v0.3-2026-05",
  "purpose": "Public operating contract for core Moral Trade security headers, private-cache controls, rate-limit surfaces, email-outbox safety gates, retention lifecycle controls, observability metrics, fallback behavior, and rollout gates.",
  "securityHeaders": [
    {
      "code": "strict_transport_security",
      "label": "Strict Transport Security",
      "evidence": "next.config.ts sets Strict-Transport-Security for all routes."
    },
    {
      "code": "x_content_type_options",
      "label": "No MIME sniffing",
      "evidence": "next.config.ts sets X-Content-Type-Options: nosniff."
    },
    {
      "code": "x_frame_options",
      "label": "Frame denial",
      "evidence": "next.config.ts sets X-Frame-Options: DENY."
    },
    {
      "code": "referrer_policy",
      "label": "Referrer policy",
      "evidence": "next.config.ts sets Referrer-Policy: strict-origin-when-cross-origin."
    },
    {
      "code": "permissions_policy",
      "label": "Permissions policy",
      "evidence": "next.config.ts disables camera, microphone, geolocation, and payment."
    },
    {
      "code": "csp_report_only",
      "label": "CSP report-only baseline",
      "evidence": "next.config.ts publishes a Content-Security-Policy-Report-Only baseline."
    },
    {
      "code": "private_no_store",
      "label": "Private route no-store",
      "evidence": "Private dashboard, admin, profile API, and job API routes get private no-store headers."
    }
  ],
  "rateLimitSurfaces": [
    { "key": "public_contract_read", "window": "1 minute", "limit": 240 },
    { "key": "signup", "window": "15 minutes", "limit": 5 },
    { "key": "login", "window": "15 minutes", "limit": 8 },
    { "key": "offer_create", "window": "15 minutes", "limit": 8 },
    { "key": "privacy_access_request", "window": "1 day", "limit": 12 },
    { "key": "match_concierge_request", "window": "1 day", "limit": 10 },
    { "key": "offer_comment", "window": "15 minutes", "limit": 12 },
    { "key": "offer_collection_read", "window": "1 minute", "limit": 120 },
    { "key": "offer_detail_read", "window": "1 minute", "limit": 120 },
    { "key": "offer_facets_read", "window": "1 minute", "limit": 120 },
    { "key": "offer_follow_write", "window": "1 minute", "limit": 30 },
    { "key": "offer_create_similar", "window": "1 minute", "limit": 30 },
    { "key": "saved_search_write", "window": "1 minute", "limit": 30 },
    { "key": "copilot_draft_review", "window": "1 minute", "limit": 30 },
    { "key": "match_signal_evaluate", "window": "1 minute", "limit": 60 },
    { "key": "matching_clearing_execute", "window": "1 minute", "limit": 20 },
    { "key": "clearing_preview_execute", "window": "1 minute", "limit": 30 },
    { "key": "baseline_integrity_enforce", "window": "1 minute", "limit": 20 },
    { "key": "agreement_amendment_enforce", "window": "1 minute", "limit": 20 },
    { "key": "side_agreement_enforce", "window": "1 minute", "limit": 20 },
    { "key": "trade_classification_enforce", "window": "1 minute", "limit": 20 },
    { "key": "template_conformance_enforce", "window": "1 minute", "limit": 20 },
    { "key": "review_capacity_enforce", "window": "1 minute", "limit": 20 },
    { "key": "participant_term_sheet_enforce", "window": "1 minute", "limit": 20 },
    { "key": "recipient_acceptance_enforce", "window": "1 minute", "limit": 20 },
    { "key": "ai_preference_elicitation_enforce", "window": "1 minute", "limit": 20 },
    { "key": "post_clear_audit_enforce", "window": "1 minute", "limit": 20 },
    { "key": "non_public_goods_subsidy_enforce", "window": "1 minute", "limit": 20 },
    { "key": "direct_pair_clearing_enforce", "window": "1 minute", "limit": 20 },
    { "key": "cause_bucket_taxonomy_enforce", "window": "1 minute", "limit": 20 },
    { "key": "resource_compatibility_enforce", "window": "1 minute", "limit": 20 },
    { "key": "net_offset_accounting_enforce", "window": "1 minute", "limit": 20 },
    { "key": "challenge_appeal_evaluate", "window": "1 minute", "limit": 30 },
    { "key": "challenge_appeal_enforce", "window": "1 minute", "limit": 20 },
    { "key": "disclosure_evaluate", "window": "1 minute", "limit": 30 },
    { "key": "review_workflow_evaluate", "window": "1 minute", "limit": 60 },
    { "key": "profile_portability", "window": "1 minute", "limit": 12 },
    { "key": "background_opportunity_brief_read", "window": "1 minute", "limit": 60 },
    { "key": "background_opportunity_feedback_write", "window": "1 minute", "limit": 30 },
    { "key": "background_helper_run_write", "window": "1 minute", "limit": 12 },
    { "key": "background_wish_interview_write", "window": "1 minute", "limit": 20 },
    { "key": "background_source_summary_write", "window": "1 minute", "limit": 12 },
    { "key": "background_intro_packet_write", "window": "1 minute", "limit": 12 },
    { "key": "background_private_overlap_check", "window": "1 minute", "limit": 12 },
    { "key": "wish_registry_search", "window": "1 minute", "limit": 60 },
    { "key": "analytics_ingest", "window": "1 minute", "limit": 120 }
  ],
  "privacyAndSessionControls": [
    {
      "key": "supabase_auth_cookies",
      "label": "Supabase auth cookies",
      "evidence": "src/lib/supabase/proxy.ts refreshes auth claims through server-side cookies."
    },
    {
      "key": "private_route_cache_control",
      "label": "Private route cache control",
      "evidence": "Private route prefixes receive Cache-Control: private, no-store."
    },
    {
      "key": "data_right_requests",
      "label": "Data-right request lane",
      "evidence": "Profile data-right requests validate destructive/corrective details and due dates."
    },
    {
      "key": "field_level_disclosure_grants",
      "label": "Field-level disclosure grants",
      "evidence": "Background networking grants stage public previews, detail requests, and mutual consent."
    },
    {
      "key": "email_outbox_safety_gate",
      "label": "Email outbox safety gate",
      "evidence": "src/lib/moral-trade/email-copy.ts centralizes generic dashboard-directed Moral Trade email copy and src/app/api/jobs/email/route.ts suppresses unsafe rows before provider send when body text contains contact details, exact offer terms, payment amounts, agreement or payment identifiers, evidence, raw source notes, or private wish markers."
    },
    {
      "key": "audit_events",
      "label": "Audit events",
      "evidence": "Match, privacy, and admin actions record audit events where disclosure is safe."
    }
  ],
  "retentionControls": [
    {
      "key": "account_profile_lifecycle",
      "label": "Account and profile lifecycle",
      "scope": "Authenticated account records, opt-in public profiles, profile export/import records, and profile portability schema metadata.",
      "retentionWindow": "Kept while the account, public profile, or review record needs it; export, correction, deletion, and restriction requests must route through authenticated dashboard or privacy support lanes.",
      "evidence": "src/app/privacy/page.tsx publishes account/profile retention and src/app/api/profile/export plus src/app/api/profile/import use private no-store profile portability APIs."
    },
    {
      "key": "private_wish_source_lifecycle",
      "label": "Private wish and source lifecycle",
      "scope": "Private wishes, source summaries, approved source-derived profile signals, matching preferences, and consent-gated background-networking inputs.",
      "retentionWindow": "Kept only for the consent scope or review workflow that needs it; expired or revoked source summaries and profile signals stop affecting matching, and exact wishes, raw source text, source notes, and shadow-run drafts remain excluded from public cards, analytics, public contract routes, and search previews.",
      "evidence": "Data-model and disclosure contracts require field-level grants, stage scope, expiry, and private/public boundaries before disclosure."
    },
    {
      "key": "evidence_provenance_lifecycle",
      "label": "Evidence and provenance lifecycle",
      "scope": "Evidence metadata, reviewer decisions, state-transition event records, and append-only provenance activities.",
      "retentionWindow": "Append-only review/provenance records are retained for audit integrity; corrections append new activities rather than mutating prior records, and raw evidence artifacts are excluded from public APIs.",
      "evidence": "Provenance contract publishes append-only persistence tables, correction rules, sample bundle summaries, and raw-artifact exclusion."
    },
    {
      "key": "payment_donation_reference_lifecycle",
      "label": "Payment and donation reference lifecycle",
      "scope": "Stripe payment identifiers, donation-route handoff references, payment status, amount, cadence, and review evidence notes.",
      "retentionWindow": "Retained only where reconciliation, dispute handling, audit integrity, or compliance needs require it; public routes must not claim custody, escrow, or guarantee payment protection.",
      "evidence": "Privacy and terms pages publish payment/donation processor boundaries and non-custody claims."
    },
    {
      "key": "analytics_attribution_lifecycle",
      "label": "Analytics and attribution lifecycle",
      "scope": "Approved funnel event type, route path, coarse metadata buckets, partner attribution, and optional authenticated profile id.",
      "retentionWindow": "Only redacted funnel records are eligible for storage; exact wishes, contact details, report bodies, raw source notes, private evidence artifacts, and free-form payloads are excluded before insert. Browser-level opt-out clears attribution and suppresses optional funnel-event inserts.",